audacity fork creator steps down. claims his life is in danger,github
supreme court sides with american express on merchant fees,nytimes
memeo is bringing a google docs reader to the ipad,techcrunch
show hn  ping parse  network utility,github
bootbasic interpreter in 512 bytes,github
what s going on with bitcoin exchange mt. gox ,techcrunch
an appropriate use for an animated gif in github,github
habits   terminal based spaced repetition utility in go,github
lift framework 3.0.0 released,github
algorithms and utils for machine learning in javascript,github
pterosaur  full power of vim in each firefox text field,github
contractors vie for plum work  hacking for u.s. government,nytimes
show hn  irrational radixes and integer packing using the golden ratio,github
health care that puts a computer on the team,nytimes
campaigns hit economic themes in key state of ohio,nytimes
angellist syndicates faq for entrepreneurs,techcrunch
symfony live paris 2015 talks,github
algo   set up a personal ipsec vpn in the cloud,github
want to buy a self-driving car  trucks may come first,nytimes
can you name this cluster bomb ,nytimes
airbnb s female employee representation down since last diversity report,techcrunch
a design pattern you can use to make web forms copy pasteable and spreadsheets,github
a  -crdt multi-value register in less than 100 lines of clojure script,github
text-overflow ellipsis for multiple lines using js,github
bailador   perl6 web framework,github
fyne calculator v1.0.0 has been released,github
show hn  open source django rest react redux blog. dockerized  has auth,github
cordova touch id plugin for ios,github
roku unveils the  roku se   a $50 entry-level streamer,techcrunch
zira editor   a lightweight php editor for linux  android and raspberry pi,github
checkout my latest dotfiles for web development for os x machine,github
show hn  shared   data exchange and persistence,github
f.b.i. s urgent request  reboot your router to stop russia-linked malware,nytimes
show hn  go styleguide,github
opinion  why zoom is terrible,nytimes
u.s. suicide rate surges to a 30-year high,nytimes
show hn  robust tv anime series renamer in python,github
batch image renamer using microsoft deep learning,github
robotics development environment with ros in c   and python,github
50 years after the 1964 worlds fair.,nytimes
after nude jesse williams video  theater turns camera on audience,nytimes
how a state plans to turn coal country into coding country,nytimes
i told you it was private,github
teachers  will we ever learn ,nytimes
show hn  lead capture widget made with reactjs,github
payments startup clinkle lays off a quarter of its staff,techcrunch
rustlings  small exercises to get you used to reading and writing rust code,github
js optimization killers,github
the 8-year-old programmer,nytimes
ethereum  a virtual currency  enables transactions that rival bitcoin s,nytimes
udacity says it can teach tech skills to millions,nytimes
the walkman wasn t invented in japan,nytimes
vaccines are coming  but pandemic experts expect a  horrible  winter,nytimes
flatte for mysql-like transaction and auto denormalization at firebase. nosql,github
europe s tado raises another $23m to grow smart thermostat and ac business,techcrunch
show hn  masking   command line tool for anonymizing database records,github
iranian hackers targeted presidential campaign  microsoft says,nytimes
the reign of recycling,nytimes
show hn  brushes  ios painting app  is now open-source,github
show hn  awesome space  a repository of open source space-related resources,github
show hn  15-puzzle in elm,github
rspec 2 syntax cheat sheet by example,github
snakeware   linux distro with python userspace inspired by commodore 64,github
show hn  bridge function between amazon kinesis streams and aws step functions,github
an atlas of upward mobility shows paths out of poverty,nytimes
france proposes new rules for internet equal access,nytimes
aol is shutting down aol music,techcrunch
  here s some pr for you  cdnetworks ,techcrunch
 rolling coal  in diesel trucks  to rebel and provoke,nytimes
it s a briefcase it s a pizza box no  it s a mini satellite,nytimes
reinforcement learning tutorial  from zero to state of the art,github
show hn  cisco-spark client for linux os x,github
transmogrifai  automated machine learning for structured data with apache spark,github
how to file cryptocurrency taxes in a bear year,techcrunch
broadcast your location to friends with google latitude,techcrunch
bull   utility framework for android,github
lunarvim 1.0  an ide layer for neovim with sane defaults,github
the 1st embedded ui framework could run in docker container,github
monkeys can make stone tools  but they don t use them,nytimes
swapgs attack poc  cve-2019-1125 ,github
china threatens to squeeze iphone sales if donald trump initiates a trade war,techcrunch
flight attendant drafted her novel on cocktail napkins. it took off,nytimes
both apple and ea deny money exchanged to keep plants vs. zombies 2 off android,techcrunch
install archlinux as the wsl  windows subsystem for linux  host,github
cixl   a minimal scripting language,github
github back to operating normally,github
concurrent trie-hash map library,github
biometric keystroke based authentication  2015 ,github
branding workaholism as a desirable lifestyle choice,nytimes
at risk in a big quake  39 of san francisco s top high rises,nytimes
xcode plugin to adjust font size with   ,github
facebook connect launch scheduled for november 30,techcrunch
steve yegge  notes from the mystery machine bus  2012 ,github
internet-plus-equality  a userscript that equalises the internet.,github
can you live a year on virtual currency  dibspace s founder will find out,techcrunch
.net maui  .net multi-platform app ui,github
the iphone could be the ultimate study machine,techcrunch
coconut  simple  elegant  pythonic functional programming,github
authy brings two-factor authentication to wordpress sites,techcrunch
scientists  and universe s odd behavior  are recognized with $3m prizes,nytimes
text pastry  extend the power of multiple selections in sublime text,github
hook objc msgsend to trace objective-c method callz,github
autoscaling digitalocean block storage,github
show hn  snackis   a post-modern enigma-device,github
emma boettcher beat james holzhauer on  jeopardy  ,nytimes
regulators should favor lyft and uber  not taxis for safety reasons,techcrunch
show hn  easy magic-link authentication   cierge,github
not up for debate  the science behind vaccination,nytimes
elon musk s spacex is raising money at a valuation approaching $10b,techcrunch
javascript source to source compiler minifier  in python,github
agloco doesn t pay to surf  joins deadpool,techcrunch
sorting out graph processing,github
awk in haskell,github
when they warn of rare disorders  these prenatal tests are usually wrong,nytimes
walmart to test a free three-day shipping service.half the price of amazon prime,techcrunch
chile crisp,nytimes
sorting algorithms visualized using the blender python api,github
pyteaser takes any news article and extract a brief summary from it.,github
apple acquires power efficient led tech company luxvue,techcrunch
amazon s prophet and losses,nytimes
rust-lang  38899  borrowed referent of a  t sometimes incorrectly allowed,github
vue-cli might contain malware from a dependency,github
geth v1.7.2  urgent update  out yes  byzantium hotfix. please update asap,github
latest batch of 500 startups companies,techcrunch
remote raises $35m to help orgs with global workforce payroll  benefits and more,techcrunch
show hn  get latest php errors in email  learning python ,github
techcrunch report of space jam page,techcrunch
is  simple way to check whether the current element matched against a selector,github
 spammers  take advantage of death in boston,nytimes
google s china stance  more about business than thwarting evil,techcrunch
judge throws out conviction in cyberbullying case,nytimes
wordpress.com goes open source and gets a desktop app,techcrunch
show hn  contact dashboard. the no internet  internet,github
a react component that observe changes in the intersection of a target element,github
with 40  customizable plugins  seesmic desktop 2 aggregates the realtime web,techcrunch
a command line replacement for zapier and ifttt,github
what does a ghost smell like  google nose.,techcrunch
private detective for your android application,github
case study  how piracy destroys app profits,techcrunch
inside elon musk s big plans for twitter,nytimes
sorry  strivers  talent matters,nytimes
protocol buffers for javascript. finally,github
public  netcat text   protocol client,github
show hn  guitktk   make and evolve a gui and its toolkit simultaneously,github
class-validator   best validation library for typescript,github
dorsey  under fire from both parties  defends labeling tweets,nytimes
ditch the faux hoverboard and commute with gi flybike  a foldable electric bike,techcrunch
after lapses  c.d.c. admits a lax culture at labs,nytimes
show hn  i made a bunch of gems from scripts i used often,github
searching for sanders in a russian archive,nytimes
monitor pastebin for your email or passwords,github
a live2d anime figure vuejs component,github
fission  fast serverless framework for kubernetes,github
googler   power tool to search google  web  news  videos  from the command-line,github
the lost history of one of the world s strangest science experiments  2019 ,nytimes
fibonacci implementation in android using kotlin,github
picnichealth  yc s14  lands $40m to accelerate patient-centric medical research,techcrunch
distrust of the minneapolis police  and also the effort to defund them,nytimes
valuation shell game  silicon valley s dirty secret,nytimes
jvm language stats  may 2016,github
compiling to c,github
rss namespace extension for podcast,github
u.s. discovers est. $1 trillion of minerals in afghanistan,nytimes
san bernardino da claims syed farouk s iphone may house  cyber pathogen ,techcrunch
in venice  high-tech tracking of tourists stirs alarm,nytimes
facebook begins building its own data center in oregon,techcrunch
the twitter story fail,techcrunch
can  california s  housing mess be solved ,nytimes
the state of robotics for 2015,techcrunch
nymphcast   open-source chromecast alternative,github
dungeon-mode  create free  as in freedom  rpgs with gnu emacs,github
 juul-alikes  are filling shelves with sweet  teen-friendly nicotine flavors,nytimes
a history of live programming,github
insurance giant aetna is leaving hartford for new york city,nytimes
joseph bachelder iii  engineer of the golden parachute  has died,nytimes
in defense of cultural appropriation,nytimes
47 000 ticks on a moose  and that s just average. blame climate change,nytimes
repl to any browser in the cloud,github
document.all willful violation,github
leaked hacking team code to edit browser history ,github
glide  smooth mousewheel scroll for web projects,github
stitch fix has confidentially filed for an ipo,techcrunch
github was down,github
after dominating the short-video market  tiktok considering a music service,techcrunch
what the  great delicious exodus  looked like for pinboard,techcrunch
web server for linux written in amd64 assembly,github
show hn  ancap news  a chrome ff extension to bring out hn s true colors,github
u.k. health ministry wants no oxford commas. period,nytimes
the magnificent 10  restaurants that changed how we eat,nytimes
jeff huber steps down as svp maps commerce at google,techcrunch
apple-like one page scroll website,github
i heard you like github  so i put a github in your github,github
svg identicon generator in 20 lines of code,github
show hn  dockerlabs   fast-track your docker skills,github
show hn  discord encryption,github
uptime  a simple http remote monitoring utility using node.js and mongodb,github
show hn  a library to add a command promp  and telnet  to your programs,github
robots will cover the olympics for the washington post,techcrunch
will cloud computing make everything  and everyone  work harder ,nytimes
arrestdb  a restful php api for sqlite  mysql and postgresql databases,github
spectral leaves stealth and raises $6.2m for its devsecops service,techcrunch
inequality  outsourcing  and the tale of janitors at apple vs. kodak,nytimes
china s didi kuaidi is raising $1b more to battle uber,techcrunch
a brief history of tinder,techcrunch
uber copter to offer flights from lower manhattan to jfk,nytimes
the secret history of women in coding,nytimes
everything the tech world says about marketing is wrong,techcrunch
minitt-rs  extended implementation of mini-tt in rust,github
exeger takes $38m makes flexible solar cells for self-powered gadgets,techcrunch
a simple and powerful rest api framework for go 1.1,github
twine  the video-game technology for all,nytimes
michael arrington   we need more opinion in news  not less ,techcrunch
code for a programmer s introduction to mathematics,github
camera   a top-selling iphone app  expands to ipad,nytimes
how uber uses interaction design to manipulate its drivers,nytimes
pstack for node.js apps,github
meetic acquires match.com s european operations,techcrunch
db with  60k names by culture and gender  ai ml dl nlp  want grow with your help,github
biden s infrastructure plans could boost startups,techcrunch
show hn  wolkenkit-boards   a tool for collaboratively organizing notes,github
frases curtas  pt-br ,github
public datasets,github
fly-along companions offer a way for older people to travel,nytimes
ibm unveils its first commercial quantum computer,techcrunch
adblock plus closes in on a billion downloads,techcrunch
moleskine smart notebook with creative cloud demo,techcrunch
new yorkers in high rises finding ants aren t just other people s problems,nytimes
as earth warms up  tropical virus moves to italy,nytimes
mastercard has filed a patent on its own blockchain money transfer solution,techcrunch
what you need to know about startup boards,techcrunch
uber loses license to operate in london,nytimes
virgins  booze and american elections,nytimes
google acquires the team behind an alexa-powered smartwatch for android wear,techcrunch
surveykit  android library to create beautiful surveys,github
show hn  bluetooth low energy library written with pure node.js-no bindings,github
show hn  fastshap  a fast shap kernel explainer,github
lulpeg  a port of lpeg 100  written in lua,github
dat  collaborative data,github
show hn  led-uke  the glowing ukulele,github
airbnb is popular  but renting out your car is another story,nytimes
extracting semi-structured data from pdfs on a large scale,github
show hn  copy marker   copy urls with highlighted page sections,github
new exchange is formed for trading patent rights,nytimes
performant indexes and search for academia v0.6.3,github
deepmind open-sources mujoco physics,github
shady tik tok clone removed from app store,techcrunch
private search browser cliqz buys ghostery ad-tracker tool,techcrunch
rise of the enterprise  toys ,techcrunch
nyt covid antibodies last years,nytimes
unlocking the potential of eye tracking technology,techcrunch
witty  a smart terminal emulator powered by openai codex,github
java implementation of algorithms from norvig s  artificial intelligence  book,github
horrifying pdf experiments   playable breakout in a pdf file,github
brain is not for thinking,nytimes
ghostwriter   cross-platform  aesthetic  distraction-free markdown editor,github
microsoft to buy nuance for $16b to focus on health care tech,nytimes
why linkedin should kill the r sum  and replace it with the experience graph,techcrunch
nokia s devices unit lost $452m in q1 before ms hand-off,techcrunch
facebook shutting down parse,techcrunch
electronic medical record sharing is hurt by business rivalries,nytimes
symspell  1m times faster spelling correction,github
show hn  nix-bitcoin   easily deploy bitcoin nodes and higher level protocols,github
the zennstr m manifesto,techcrunch
andreessen horowitz makes a $49m bet on jawbone,nytimes
micro web-framework for cobol,github
scientists hope to learn how pompeians lived  before the big day,nytimes
modern webapp oauth2 rest stack security checklist,github
how the huang brothers bootstrapped guitar hero to a billion dollar business,techcrunch
amanda ripley s  smartest kids in the world ,nytimes
happy st. patrick s day from crunchgear,techcrunch
can you be too incompetent to understand just how incompetent you are ,nytimes
my script that spams a google form with urban dictionary terms and definitions,github
next-gen bird three scooter comes with bigger battery and better software,techcrunch
how big tech just keeps getting bigger,techcrunch
the case against winston churchill,nytimes
women 2.0 competition winners,techcrunch
show hn  uml class and sequence diagram for c   design pattern examples,github
cray s new xc50 supercomputer hits one petaflop of computing in a single cabinet,techcrunch
the evolution of hacker news,techcrunch
consider a monarchy  america  2016 ,nytimes
the metal framework gives ios a lead in gaming for the foreseeable future,techcrunch
how we made the holiday gift guide,nytimes
microsoft tells its alternate yahoo board members it won t be needing them,techcrunch
kubernetes clusters for the hobbyist,github
show hn  controlled actions  a pack of classes that controls async routines,github
popular javascript library takes over russian pages and plays ukrainian anthem,github
entity embed  transform entities into vectors for scalable entity resolution,github
show hn  format-preserving redaction for structured test data,github
show hn  seagull   a python library for conway s game of life,github
slack stock up 48.5  after going public,techcrunch
california is booming  but californians are unhappy,nytimes
chartio  yc s10  improves the way you visualize your data,techcrunch
htc and valve have cracked the vr code,techcrunch
dji robomaster s1 on github,github
komodor raises $42m series b to automate k8s troublehsooting,techcrunch
pass the books. hold the oil.,nytimes
show any data  in redis  mongodb  file   in django admin,github
frequency analytics   open source private web analytics server,github
show hn  neural audio style transfer for tensorflow,github
show hn  codebraid   live code in pandoc markdown  python  julia  rust  r ,github
show hn  scrape the last 20 hacker news pages into one page using clojure,github
techcrunch interview with eric schmidt  larry page and sergey brin,techcrunch
why you hate work,nytimes
totango picks up $15.5m more,techcrunch
chat service aims to challenge bloomberg,nytimes
jslint now on github,github
show hn  a boilerplate for node.js apis designed for apps  written in typescript,github
 the big short 2.0   how hedge funds profited off the pain of malls,nytimes
gillmor gang live 10.01.16,techcrunch
tinyld   simple and performant language detection library for node.js,github
a smarter lightbulb that doesn t require an app to control it,techcrunch
amber  amber is a code search and replace tool inspired by ack  ag,github
twitxr - like twitter  with pictures. yeah  it s photoblogging.,techcrunch
google image search ads in the wild  looks like they need work,techcrunch
show hn  local dynamodb snapshots as containers,github
spoofing travis build statuses,github
the mystery man who runs italy s  five star  from the shadows,nytimes
form validation approach for bootstrap not depending or jquery  or anything ,github
apple s iphone recycling robot  2018 ,techcrunch
amazon web services gets personal and pretty,nytimes
clientside javascript module loader with localstorage caching,github
just pushed one of my weekend projects  openlogin,github
drink up  business travelers. the minibar is on the way out,nytimes
immune system  unleashed by cancer therapies  can attack organs,nytimes
ruby on rails off track ,github
show hn  i built a cli tool in go to bulk merge github pull requests,github
ios human interface design  re written in pure html,github
show hn  prerender.js to speed up browsing experience,github
a standalone  lightweight  fast asset manager  designed for php applications.,github
show hn  mkdocs material boilerplate   starter kit,github
samb  server assembly  built rest apis with nginx like configuration,github
google analytics now lets you track web and app data in a single view,techcrunch
htail  an utility that displays your common logs  to stdout and in the browser,github
querulous examples  twitter s scala database api ,github
css centering explorer   find the way to center things in css,github
if you care about remote employees  start tracking their performance,techcrunch
what github cant do for you,github
airbnb for work is getting bigger,techcrunch
ringojs modules and how to fix the global object,github
show hn  gebug has now web ui,github
autoscraper  a smart automatic web scraper for python,github
flare  api notification service,github
sf will regulate electric scooter sharing,techcrunch
self-hosted enterprise vpn server built using the openvpn protocol,github
mobile safari bookmarklet to enable airplay video for web content,github
theres a business in my trash,nytimes
show hn  nip - the only unix tools you ll ever need,github
generalized monad comprehensions in python  warning  evil hack ,github
introducing awesomeserver ,github
node.js web crawler framework,github
when stealing isn t stealing,nytimes
coghead grinds to a halt  heads to the deadpool,techcrunch
show hn  toapi   a library letting any web site provide apis,github
sv angel won t be raising another fund,techcrunch
dragon daemon   ip camera streaming server,github
ask hn  language aware diffs on github pull requests,github
gogoro s new e-bike brand eeyo will launch in the us first,techcrunch
true link  yc s13  to help the elderly avoid scammers with pre-paid visa cards,techcrunch
a hacking of more than $50m dashes hopes in the world of virtual currency,nytimes
smooth-dnd  light and fast drag and drop library for many scenarios,github
creators need better community tools. circle wants to fill the gap,techcrunch
levandowski sentenced to 18 months in prison as new lawsuit against uber filed,techcrunch
show hn  brace lang   parse brace groups and evaluate them however you want,github
memories lost to a whirlwind alight on facebook to be claimed,nytimes
hazel  lighweight update server for electron apps,github
a toolkit to quickly build apps with react  graphql and meteor,github
show hn  automation for ha hashicorp vault cluster  aws  gcp  azure ,github
an elite nyc hospital charges virus test fees,nytimes
show hn  find your google contacts in facebook leak,github
power your erlang website with google spdy,github
show hn  libvirtd  mount your file system automatically on boot,github
adblock fast  a new  faster ad blocker for chrome  opera  and ios 9,github
quil  processing and clojure,github
it s like a war,nytimes
annie  simple video download cli tool like youtube-dl written in go,github
git - the simple guide,github
at least a clever lightweight orm for java,github
ebay acquires nonprofit fundraising tool missionfish,techcrunch
americans use more online social networks,nytimes
china s cctv surveillance network took just 7 minutes to capture bbc reporter,techcrunch
death to jira,techcrunch
the young developer s guide to debugging javascript,nytimes
framework for keyword-driven test  0.1.10 released,github
sternenwecker   a light alarm,github
isolation and fault tolerance library  modeled after netflix s hystrix,github
tackling inflammation to fight age-related ailments,nytimes
dolores   local development dynamic tls proxy,github
loopt eagerly joins the iphone gold rush,nytimes
design patterns for humans   an ultra-simplified explanation,github
browser preview for vscode,github
the perfect weapon  how russian cyberpower invaded the u.s,nytimes
show hn  a simple cryptanalysis tool for the vigenere cipher,github
make 2020 the year of less sugar,nytimes
show hn  react single page blog app using react router and the cosmic js api,github
set up a coredata implementation embracing the static  type-safe nature of swift,github
economic optimism  yes  i ll take that bet,nytimes
struckdown  an experimental markdown processing system in rust,github
restful ajax web app basics   mimic gmail with backbone.js  soa  tsa  ,github
marionettejs  backbone.marionette  v1.1 release notes,github
if programming languages were cars,github
g.e. makes a sharp  pivot  on digital,nytimes
immigrants  babies taking over ,nytimes
awesome-geospatial,github
show hn  ebook repository for the permaweb,github
data science cheatsheets,github
show hn  arkade   kubernetes apps  the easy way,github
audio reveals what john kerry told syrians behind closed doors,nytimes
show hn  deep learning for windmill output forecasting with pytorch,github
new relic shifts with changing monitoring landscape,techcrunch
mark pincus  founder of zynga  is replaced as ceo again,nytimes
a  star trek  dream  spread from upstate new york,nytimes
journalism generated by machine is on the rise,nytimes
nitter.net s ssl certificate expired today,github
convert css to react components in one step,github
mail-in-a-box security guide,github
megabots raises $2.4m to create league of human-piloted  giant fighting robots,techcrunch
apple s ios 14.3 does not render webp images correctly  337,github
harvey keitel  ceo  or how to pull off the impossible,techcrunch
inside embark s mission to make autonomous trucking a reality,techcrunch
amazon has a business proposition for you  deliver its packages,nytimes
new automation tool that loves bash,github
what it means to design for growth at the new york times,nytimes
payment processor to stop working with daily fantasy sports clients,nytimes
show hn  fastapi-mvc   generate customizable fastapi projects,github
show hn  pretty-print your tabular data with go,github
elon musk  under financial pressure  pushes to make money from twitter,nytimes
