hackathon starter rails,github
go library providing algorithms optimized for modern cpus,github
controversial crime tracker app expands to sf with $12m in funding,techcrunch
module listing discovery in haskell s cabal,github
in astounding test  scientists revive damaged lungs for transplant,nytimes
calatrava  interesting cross mobile development platform,github
show hn  idiot comedy steps towards classical shor s,github
show hn  apimodel  interact with api s in swift using realm.io and rest,github
mobile first or mobile worst ,techcrunch
show hn  rapid prototyping geolocative audio,github
the online ad recession continues. is this what a reset looks like ,techcrunch
fig 1.0 released,github
electric sheep raises $21.5m to make off-the-shelf lawnmowers autonomous,techcrunch
27 killed in connecticut shooting  including 18 children,nytimes
onion omega brings web smarts to iot hardware hacking,techcrunch
facebook sues operator of instagram clone sites,techcrunch
the cost of mobile ads on 50 news websites,nytimes
colorpul - a simple generator that uses online photos to create color palettes,github
japanese sneaker platform soda raises $56.4m  accquires rival monokabu,techcrunch
publish node modules with ease,github
here comes the google mafia,techcrunch
private internet access vpn open source repository,github
show hn  nuage   org mode companion app for browsers,github
python in 13 characters   inspired by jsfuck,github
coveo raises us$172m at $1b  valuation for ai-based enterprise search,techcrunch
show hn  securely set the same password on thousands of linux servers,github
two classes  divided by  i do ,nytimes
show hn  slack 538   presidential forecasts in slack,github
show hn  cpu simulator in 60 lines of code,github
show hn  vimer   declutter your desktop by opening files in existing gvim macvim,github
how doe the human soul survive atrocity ,nytimes
show hn  coffeescript ui  cui ,github
collection of desktop apps built with neutralinojs,github
yahoo japan bids to buy travel booking site ikyu for around $830m,techcrunch
in snap s tumble  startups see a warning from wall street,nytimes
reset your internet right with button press  or over bluetooth ,techcrunch
steven strogatz on the elements of math,nytimes
pinball museum will auction 1 700 arcade games after closing its doors,nytimes
charge card startup brex aims for decacorn success,techcrunch
gophernews   golang wrapper for hackernews api,github
cad sketcher   constraint-based geometry sketcher for blender,github
instagram implements an ai system to fight mean and harassing comments,techcrunch
c  7 proposal  nullable reference types and nullability checking,github
the difference between good and bad facebooking  2017 ,techcrunch
one on one  anil dash of expert labs,nytimes
show hn  unified fortran code for parallel programming,github
phishing spamming tool,github
show hn  klipse   code evaluator pluggable on a web page clojure ruby javascript,github
dieter rams  design principles applied to software engineering,github
instascii  an instafeed.js plugin that returns ascii versions of images,github
the boomerang kids won t leave,nytimes
scrolljs a number scroller to be embedded in your web apps,github
javascript ui component for interacting with audio waveforms,github
for the single founder who can t code,techcrunch
clojure helper library that utilises spurious for setting up local aws resources,github
the u.s.s. prius,nytimes
flipper zero awesome list,github
fuzzy and semantic caption-based searching for youtube,github
james gosling  father of java  is making oceangoing robots that measure sea data,nytimes
katex  fast math typesetting for the web,github
skyrim together  mod to play online,github
u.s. shuts down web sites in piracy crackdown,nytimes
nintendo s nes classic will return to u.s. retail stores on june 29,techcrunch
go version manager,github
uisearchbarfontkit,github
trump2cash  invest whenever trump mentions a publicly-traded company,techcrunch
the most planned unplanned place around,nytimes
how far can air carry coronavirus ,nytimes
alexa adds support for reminders and named timers,techcrunch
jc  jsonify the output of linux cli tools for easier parsing in scripts,github
lady gaga and the life of passion,nytimes
 chinese millennials are  chilling   and beijing isn t happy ,nytimes
cix   comprehensive inspection of unix,github
laravel api test helpers,github
swift literal programming with docco,github
create-react-app 3.3,github
my own storybook   ctrl p everywhere,github
the kubernetes guide,github
aol in deal with microsoft to take over display ad business,nytimes
x11fs  a tool for manipulating x windows  2016 ,github
google assistant relay,github
smash is a wearable for tracking tennis technique,techcrunch
webassembly wasi support in ruby,github
away s former ceo is returning as co-chief,nytimes
covid-19 forced airbnb to rethink its product offerings,techcrunch
driving tips  how you can help limit traffic jams,nytimes
a better organised  more complete and updated mean seed,github
dug now has internationalization,github
a sexy  secure visualization of password field input,github
an open-source formatting library  fmt  version 7.0 released,github
show hn  awesome twitter,github
best practices in android development,github
apple  the record label ,techcrunch
type safe go bindings to interact with chrome remote interface,github
big list of http static servers one-liners,github
disclosure cuts interest in disabled workers  especially by small business,nytimes
supertokens   open-source alternative to auth0   firebase auth   aws cognito,github
hulk hogan awarded 115m in gawker case,techcrunch
knitting machines power up with computer-generated patterns for 3d shapes,techcrunch
amazon ups orders from kindle fire suppliers to 5 million units,techcrunch
actix-session v0.6 released,github
reddit names marty weiner  early engineer at pinterest  its first cto,techcrunch
show hn  go library for sending messages via telegram  discord  email and slack,github
she wrote a dystopian novel. what happened next was pretty dystopian,nytimes
playlistfromsong  create an offline music playlist from a single song,github
small practical guide on flow and typescript for javascript developers,github
frost plank theme  quite dark plank theme,github
kissui.scrollanim   css3 scroll animation library,github
after passing 10m monthly active users  whisper hires its first president,techcrunch
react passage   link and redirect to routes safely in your react applications,github
for the living  a donated face  for the dead  a lifelike replacement,nytimes
25 songs that tell us where music is going,nytimes
letter of recommendation  safety razors,nytimes
soup sieve   a modern css selector implementation for beautifulsoup,github
lo2  simple youtube-dl web front end,github
electronic health tracking increasingly common  researchers say,nytimes
show hn  raycasting portals - a software portal rendering game engine,github
email overload means we re never not working ,techcrunch
apple started a $1b fund to create advanced manufacturing jobs in the us,techcrunch
acadock  docker container monitoring,github
show hn  simple rust microservices,github
show hn  vibase   edit db tables quickly with vim,github
conversations  android xmpp client  gains support for a v calls,github
elon musk s boring company lands $48.7m contract for underground  people mover ,techcrunch
scope context coloring plugin for sublime,github
replaced occurrences of master slave terminology with leader follower,github
despite looming jail time  gurbaksh chahal is back as gravity4 ceo,techcrunch
a cashless society  it s already here,nytimes
making government suck less,techcrunch
ssdb   a fast nosql database  an alternative to redis,github
timehop admits that additional personal data was compromised in breach,techcrunch
evidence of toxic environment for women in economics,nytimes
kythe  pluggable language-agnostic ecosystem for making tools working with code,github
snapchat helped register over 400 000 voters,nytimes
muscular west coast worker is on way to build new tappan zee,nytimes
cross-platform gl dx vk abstraction layer open sourced by unity employee,github
over a third of young people in foster care in new york city identify as l.g.b.t,nytimes
nissan says electric car is sold out for this year,nytimes
telebot   easy way to write telegram bots  node.js ,github
clubhouse launches payments so creators can make money,techcrunch
evolutionary neural networks,github
racial bias  even when we have good intentions,nytimes
want to do business in silicon valley  better act nice,nytimes
researchers demo algorithm that lets you take clear photos through reflections,techcrunch
